,author,title,desciption,url,source,content,pub_date,photo_url,text_combined,tokens,lemms
18,Justine Calma,“This man is not our boss” — EPA workers rally against DOGE cuts,"Environmental Protection Agency workers took to the streets across the US today to protest drastic cuts President Donald Trump and Elon Musk’s DOGE have made at the federal agency whose mission is to “protect human health and the environment.”  Musk, the face…",https://www.theverge.com/news/635710/doge-musk-trump-environmental-protection-agency-epa,The Verge,"How do you spell corruption? E-L-O-N, demonstrators chanted while marching in support of the Environmental Protection Agency.
How do you spell corruption? E-L-O-N, demonstrators chanted while marchi… [+4522 chars]",2025-03-25,https://platform.theverge.com/wp-content/uploads/sites/2/2025/03/257640_EPA_workers_protest_AKrales_0285.jpg?quality=90&strip=all&crop=0%2C10.732984293194%2C100%2C78.534031413613&w=1200,this man is not our boss epa workers rally against doge cuts environmental protection agency workers took to the streets across the us today to protest drastic cuts president donald trump and elon musk s doge have made at the federal agency whose mission is to protect human health and the environment musk the face,man boss epa workers rally doge cuts environmental protection agency workers took streets across us today protest drastic cuts president donald trump elon musk doge made federal agency whose mission protect human health environment musk face,man boss epa workers rally doge cuts environmental protection agency workers took streets across us today protest drastic cuts president donald trump elon musk doge made federal agency whose mission protect human health environment musk face
19,Mia Sato,Elon Musk is paying voters again ahead of the Wisconsin Supreme Court election,"Not satisfied with effectively buying a co-president role in Donald Trump’s administration, Elon Musk has turned his attention — and money — towards a key race in the swing state of Wisconsin. The billionaire’s America PAC is claiming to give $100 to register…",https://www.theverge.com/news/633834/elon-musk-paying-voters-petition-wisconsin-supreme-court-race,The Verge,"Musk has already funneled $14 million into the consequential race, which would swing the balance of power in the states highest court.
Musk has already funneled $14 million into the consequential ra… [+2854 chars]",2025-03-21,https://platform.theverge.com/wp-content/uploads/sites/2/2025/02/STK022_ELON_MUSK_4_CVIRGINIA_5.jpg?quality=90&strip=all&crop=0%2C10.732984293194%2C100%2C78.534031413613&w=1200,elon musk is paying voters again ahead of the wisconsin supreme court election not satisfied with effectively buying a co president role in donald trump s administration elon musk has turned his attention and money towards a key race in the swing state of wisconsin the billionaire s america pac is claiming to give  to register,elon musk paying voters ahead wisconsin supreme court election satisfied effectively buying co president role donald trump administration elon musk turned attention money towards key race swing state wisconsin billionaire america pac claiming give register,elon musk paying voters ahead wisconsin supreme court election satisfied effectively buying co president role donald trump administration elon musk turned attention money towards key race swing state wisconsin billionaire america pac claiming give register
20,Umar Shakir,Porsche’s next Taycan gets an infotainment upgrade — but no new CarPlay,"Porsche is upgrading the infotainment in the upcoming 2026 model year Taycan, 911, Panamera, and Cayenne with “more responsive” software and features such as an Alexa personal assistant. The 2026 Porsche Communication Management (PCM) will get the Porsche App…",https://www.theverge.com/news/635940/porsche-2026-911-taycan-infotainment-pcm-alexa-carplay,The Verge,"Porsche is expanding the Macan Electrics App Center to new vehicles and adding Alexa.
Porsche is expanding the Macan Electrics App Center to new vehicles and adding Alexa.
Porsche is upgrading the … [+1843 chars]",2025-03-25,https://platform.theverge.com/wp-content/uploads/sites/2/2025/03/TA26Q3EID0006_rgb__3_A3_RGB.jpg?quality=90&strip=all&crop=0%2C10.738752916039%2C100%2C78.522494167922&w=1200,porsche s next taycan gets an infotainment upgrade but no new carplay porsche is upgrading the infotainment in the upcoming  model year taycan  panamera and cayenne with more responsive software and features such as an alexa personal assistant the  porsche communication management pcm will get the porsche app,porsche next taycan gets infotainment upgrade new carplay porsche upgrading infotainment upcoming model year taycan panamera cayenne responsive software features alexa personal assistant porsche communication management pcm get porsche app,porsche next taycan gets infotainment upgrade new carplay porsche upgrading infotainment upcoming model year taycan panamera cayenne responsive software features alexa personal assistant porsche communication management pcm get porsche app
21,Verge Staff,Self-driving cars: Google and others map the road to automated vehicles,"Google and a number of automakers are spearheading the movement to get automated vehicles on America’s roads. Self-driving cars are street legal in three states, and Google’s fleet has collectively logged over 300,000 miles of time on the road. However, there…",https://www.theverge.com/2012/12/23/3797260/self-driving-cars-automated-vehicles,The Verge,"Google and a number of automakers are spearheading the movement to get automated vehicles on Americas roads. Self-driving cars are street legal in three states, and Googles fleet has collectively log… [+12349 chars]",2025-03-03,"https://platform.theverge.com/wp-content/uploads/sites/2/chorus/uploads/chorus_asset/file/10956381/google-self-driving-car-4-stock-1024.0.jpg?quality=90&strip=all&crop=0,6.8336832165651,100,86.33263356687",self driving cars google and others map the road to automated vehicles google and a number of automakers are spearheading the movement to get automated vehicles on america s roads self driving cars are street legal in three states and google s fleet has collectively logged over   miles of time on the road however there,self driving cars google others map road automated vehicles google number automakers spearheading movement get automated vehicles america roads self driving cars street legal three states google fleet collectively logged miles time road however,self driving cars google others map road automated vehicles google number automakers spearheading movement get automated vehicles america roads self driving cars street legal three states google fleet collectively logged miles time road however
22,David Pierce,An old smartwatch favorite makes a comeback,"Hi, friends! Welcome to Installer No. 76, your guide to the best and Verge-iest stuff in the world. (If youâre new here, welcome, sorry if your bracketâs busted, and also you can read all the old editions at the Installer homepage.) This week, I have been…",https://www.theverge.com/installer-newsletter/633860/pebble-2-duo-assassins-creed-shadows-pixel-9a-installer,The Verge,"Plus, in this weeks Installer: The latest Assassins Creed is here, Day One for Windows, a controversial Tesla video, and more.
Plus, in this weeks Installer: The latest Assassins Creed is here, Day … [+11629 chars]",2025-03-21,https://platform.theverge.com/wp-content/uploads/sites/2/2025/03/Installer-76.png?quality=90&strip=all&crop=0%2C10.761625442506%2C100%2C78.476749114988&w=1200,an old smartwatch favorite makes a comeback hi friends welcome to installer no  your guide to the best and verge iest stuff in the world if you re new here welcome sorry if your bracket s busted and also you can read all the old editions at the installer homepage this week i have been,old smartwatch favorite makes comeback hi friends welcome installer guide best verge iest stuff world new welcome sorry bracket busted also read old editions installer homepage week,old smartwatch favorite makes comeback hi friends welcome installer guide best verge iest stuff world new welcome sorry bracket busted also read old editions installer homepage week
23,Abigail Bassett,Mercedes-Benz is hedging its bets with rebooted CLA sedan,"Mercedes-Benz’s electric vehicles aren’t exactly selling like hotcakes. The EQS, EQE, and EQB have largely flopped, forcing the company to make significant changes to its electrification plans.   While the automaker has scaled back its ambitions, it’s not aba…",https://www.theverge.com/news/628464/mercedes-benz-cla-ev-hybrid-mma-platform,The Verge,"The automaker plans to offer electric, hybrid, and gas versions of the upcoming model all built on the new MMA platform.
The automaker plans to offer electric, hybrid, and gas versions of the upcomi… [+6722 chars]",2025-03-13,https://platform.theverge.com/wp-content/uploads/sites/2/2025/03/25C0035_003.jpg?quality=90&strip=all&crop=0%2C10.729026323664%2C100%2C78.541947352673&w=1200,mercedes benz is hedging its bets with rebooted cla sedan mercedes benz s electric vehicles aren t exactly selling like hotcakes the eqs eqe and eqb have largely flopped forcing the company to make significant changes to its electrification plans while the automaker has scaled back its ambitions it s not aba,mercedes benz hedging bets rebooted cla sedan mercedes benz electric vehicles exactly selling like hotcakes eqs eqe eqb largely flopped forcing company make significant changes electrification plans automaker scaled back ambitions aba,mercedes benz hedging bets rebooted cla sedan mercedes benz electric vehicles exactly selling like hotcakes eqs eqe eqb largely flopped forcing company make significant changes electrification plans automaker scaled back ambitions aba
24,Alex Heath,How ‘Careless People’ is becoming a bigger problem for Meta,"Meta has aggressively pushed to discredit and silence Sarah Wynn-Williams, the author of Careless People, her memoir about working at the company as a policy director. Now, sheâs fighting back.  Attorneys for Wynn-Williams this week filed an emergency motio…",https://www.theverge.com/command-line-newsletter/634080/careless-people-sarah-wynn-williams-book-meta-congress,The Verge,"The companys attempt to squash an ex-employees controversial memoir has gotten the attention of Congress.
The companys attempt to squash an ex-employees controversial memoir has gotten the attention… [+8144 chars]",2025-03-21,https://platform.theverge.com/wp-content/uploads/sites/2/2025/03/257636_careless_people_CVirginia.jpg?quality=90&strip=all&crop=0%2C10.732984293194%2C100%2C78.534031413613&w=1200,how careless people is becoming a bigger problem for meta meta has aggressively pushed to discredit and silence sarah wynn williams the author of careless people her memoir about working at the company as a policy director now she s fighting back attorneys for wynn williams this week filed an emergency motio,careless people becoming bigger problem meta meta aggressively pushed discredit silence sarah wynn williams author careless people memoir working company policy director fighting back attorneys wynn williams week filed emergency motio,careless people becoming bigger problem meta meta aggressively pushed discredit silence sarah wynn williams author careless people memoir working company policy director fighting back attorneys wynn williams week filed emergency motio
25,Alex Heath,Anthropic’s plan to win the AI race,"Anthropic is one of the worldâs leading AI model providers, especially in areas like coding. But its AI assistant, Claude, is nowhere near as popular as OpenAIâs ChatGPT. According to chief product officer Mike Krieger, Anthropic doesnât plan to win the…",https://www.theverge.com/command-line-newsletter/630037/anthropic-plan-win-ai-race-mike-krieger,The Verge,"Why CPO Mike Krieger thinks Anthropic can win without beating ChatGPT.
Why CPO Mike Krieger thinks Anthropic can win without beating ChatGPT.
Anthropic is one of the worlds leading AI model provide… [+13314 chars]",2025-03-14,https://platform.theverge.com/wp-content/uploads/sites/2/2025/03/Mike-Krieger-CL-site-wide.png?quality=90&strip=all&crop=0%2C10.732984293194%2C100%2C78.534031413613&w=1200,anthropic s plan to win the ai race anthropic is one of the world s leading ai model providers especially in areas like coding but its ai assistant claude is nowhere near as popular as openai s chatgpt according to chief product officer mike krieger anthropic doesn t plan to win the,anthropic plan win ai race anthropic one world leading ai model providers especially areas like coding ai assistant claude nowhere near popular openai chatgpt according chief product officer mike krieger anthropic plan win,anthropic plan win ai race anthropic one world leading ai model providers especially areas like coding ai assistant claude nowhere near popular openai chatgpt according chief product officer mike krieger anthropic plan win
26,Matthew Gault,Elon Fiddles While Tesla Dealerships Burn,Someone set fire to a Tesla dealership in Rome and destroyed 17 vehicles.,https://gizmodo.com/elon-fiddles-while-tesla-dealerships-burn-2000582885,Gizmodo.com,"A Tesla dealership in Rome caught fire over the weekend, leaving behind the burned out husks of 17 of the vehicles. Police in Italy are investigating the fire as an act of arson. While one of his dea… [+3017 chars]",2025-03-31,https://gizmodo.com/app/uploads/2025/03/TeslaBurns.jpg,elon fiddles while tesla dealerships burn someone set fire to a tesla dealership in rome and destroyed  vehicles,elon fiddles tesla dealerships burn someone set fire tesla dealership rome destroyed vehicles,elon fiddles tesla dealerships burn someone set fire tesla dealership rome destroyed vehicles
27,AJ Dellinger and Matt Novak,Crowds Turn Out Across the U.S. for ‘Tesla Takedown’ Protests,"Demonstrations against Elon Musk's political influence took place at Tesla dealerships in the U.S., Canada, and Europe.",https://gizmodo.com/crowds-turn-out-across-the-u-s-for-tesla-takedown-protests-2000582579,Gizmodo.com,"Hundreds of Tesla dealerships across the United States, Canada, and Europe saw protesters descend upon their lots on Saturday as part of a global day of action organized by the Tesla Takedown protest… [+4445 chars]",2025-03-29,https://gizmodo.com/app/uploads/2025/03/GettyImages-2206922352.jpg,crowds turn out across the u s for tesla takedown protests demonstrations against elon musk is political influence took place at tesla dealerships in the u s canada and europe,crowds turn across u tesla takedown protests demonstrations elon musk political influence took place tesla dealerships u canada europe,crowds turn across u tesla takedown protests demonstrations elon musk political influence took place tesla dealerships u canada europe
28,Matthew Gault,Tesla Hate Is Making Insurance More Expensive for Owners,"As stock slumps and Americans turn against the automaker, its owners are paying higher insurance premiums.",https://gizmodo.com/tesla-hate-is-making-insurance-more-expensive-for-owners-2000577467,Gizmodo.com,"Teslas are getting more expensive to insure thanks to the manufacturers sliding fortunes and reports of vandalism against the cars. There are few markets as pure, heartless, and single-minded as auto… [+3796 chars]",2025-03-18,https://gizmodo.com/app/uploads/2025/03/TeslaProtests.jpg,tesla hate is making insurance more expensive for owners as stock slumps and americans turn against the automaker its owners are paying higher insurance premiums,tesla hate making insurance expensive owners stock slumps americans turn automaker owners paying higher insurance premiums,tesla hate making insurance expensive owners stock slumps americans turn automaker owners paying higher insurance premiums
29,Matthew Gault,Lawmakers Demand Answers From Rubio Over the $400 Million Armored Tesla Contract,A Senator and a Congressman have sent letters to the Secretary of State demanding he answer questions about a scandal that probably doesn’t exist.,https://gizmodo.com/lawmakers-demand-answers-from-rubio-over-the-400-million-armored-tesla-contract-2000573841,Gizmodo.com,Politicians are pressing Secretary of State Marco Rubio to answer questions about a government contract for armored Teslas that never existed. Sen. Richard Blumenthal (D-NY) and Congressman Gregory M… [+6127 chars],2025-03-10,https://gizmodo.com/app/uploads/2022/04/f6565bafdba3fb884da94179c52f735e.jpg,lawmakers demand answers from rubio over the  million armored tesla contract a senator and a congressman have sent letters to the secretary of state demanding he answer questions about a scandal that probably doesn t exist,lawmakers demand answers rubio million armored tesla contract senator congressman sent letters secretary state demanding answer questions scandal probably exist,lawmakers demand answers rubio million armored tesla contract senator congressman sent letters secretary state demanding answer questions scandal probably exist
30,Matt Novak,Musk Plans to Give Trump Groups $100 Million After Tesla Ad at the White House,The billionaire oligarch effectively controls the federal government right now.,https://gizmodo.com/musk-plans-to-give-trump-groups-100-million-after-tesla-ad-at-the-white-house-2000575040,Gizmodo.com,"Elon Musk is planning to give $100 million to two political groups associated with President Donald Trump, according to a report from the New York Times. The move is unprecedented in American politic… [+5302 chars]",2025-03-12,https://gizmodo.com/app/uploads/2025/03/elon-musk-donald-trump-tesla-ad-white-house-flickr.jpg,musk plans to give trump groups  million after tesla ad at the white house the billionaire oligarch effectively controls the federal government right now,musk plans give trump groups million tesla ad white house billionaire oligarch effectively controls federal government right,musk plans give trump groups million tesla ad white house billionaire oligarch effectively controls federal government right
31,Thomas Maxwell,BYD Says It Can Now Charge An Electric Car In 5 Minutes,The Chinese automaker says it will start selling vehicles with the new battery system starting next month.,https://gizmodo.com/byd-says-it-can-now-charge-an-electric-car-in-5-minutes-2000577651,Gizmodo.com,"Chinese automaker BYD continues to leave Tesla in the dust. The company introduced a new battery system on Monday that it claims can charge an electric vehicle in just five minutes, about the same ti… [+3432 chars]",2025-03-18,https://gizmodo.com/app/uploads/2025/03/GettyImages-2204058346.jpg,byd says it can now charge an electric car in  minutes the chinese automaker says it will start selling vehicles with the new battery system starting next month,byd says charge electric car minutes chinese automaker says start selling vehicles new battery system starting next month,byd says charge electric car minutes chinese automaker says start selling vehicles new battery system starting next month
32,Lucas Ropek,"Canadian Officials Cancel $100 Million Starlink Contract, Propose 100% Tariffs on Teslas",Musk is in the firing line for Trump's pointless economic war on America's allies.,https://gizmodo.com/canadian-officials-cancel-100-million-starlink-contract-propose-100-tariffs-on-teslas-2000571699,Gizmodo.com,"President Donald Trump has unleashed economic warfare on two of America’s most closely aligned trading partners (and political allies): Mexico and Canada. On Tuesday, the Trump administration put int… [+2920 chars]",2025-03-05,https://gizmodo.com/app/uploads/2024/10/MuskLeaping.jpg,canadian officials cancel  million starlink contract propose  tariffs on teslas musk is in the firing line for trump is pointless economic war on america is allies,canadian officials cancel million starlink contract propose tariffs teslas musk firing line trump pointless economic war america allies,canadian officials cancel million starlink contract propose tariffs teslas musk firing line trump pointless economic war america allies
33,Matt Novak,Elon Musk Claims X Outage From ‘Massive Cyberattack’ Without Providing Evidence,The billionaire sees conspiracies everywhere these days.,https://gizmodo.com/elon-musk-claims-x-outage-from-massive-cyberattack-without-providing-evidence-2000573986,Gizmodo.com,"X, the social media platform formerly known as Twitter, has been suffering from outages all day Monday. And owner Elon Musk has finally said what’s behind it. Well, what he thinks is behind it. The b… [+4188 chars]",2025-03-10,https://gizmodo.com/app/uploads/2025/03/elon-musk-frown-face-GettyImages-2203703329-copy.jpg,elon musk claims x outage from massive cyberattack without providing evidence the billionaire sees conspiracies everywhere these days,elon musk claims x outage massive cyberattack without providing evidence billionaire sees conspiracies everywhere days,elon musk claims x outage massive cyberattack without providing evidence billionaire sees conspiracies everywhere days
34,Thomas Maxwell,China Delays BYD Factory in Mexico Over Concerns Tech Will Leak to American Rivals,Spiderman pointing at Spiderman meme.,https://gizmodo.com/china-delays-byd-factory-in-mexico-over-concerns-tech-will-leak-to-american-rivals-2000578281,Gizmodo.com,China is frequently a target of criticism over allegations that it does not innovate but instead exfiltrates intellectual property developed abroad and wins by undercutting rivals on price. Now that … [+3860 chars],2025-03-19,https://gizmodo.com/app/uploads/2025/03/GettyImages-2204851234.jpg,china delays byd factory in mexico over concerns tech will leak to american rivals spiderman pointing at spiderman meme,china delays byd factory mexico concerns tech leak american rivals spiderman pointing spiderman meme,china delays byd factory mexico concerns tech leak american rivals spiderman pointing spiderman meme
35,Matt Novak,DOGE Plans to Rewrite Entire Social Security Codebase in Just ‘a Few Months’: Report,"Details are scarce, but this has the potential to be a disaster.",https://gizmodo.com/doge-plans-to-rewrite-entire-social-security-codebase-in-just-a-few-months-report-2000582062,Gizmodo.com,"Elon Musk’s Department of Government Efficiency (DOGE) is planning to migrate the Social Security Administration’s computer systems from the COBOL programming language to something more modern, accor… [+7280 chars]",2025-03-28,https://gizmodo.com/app/uploads/2025/03/elon-musk-white-house-feb-11-2025-GettyImages-2198395928-copy.jpg,doge plans to rewrite entire social security codebase in just a few months report details are scarce but this has the potential to be a disaster,doge plans rewrite entire social security codebase months report details scarce potential disaster,doge plans rewrite entire social security codebase months report details scarce potential disaster
36,Thomas Maxwell,"‘Inferior’ Starlink Will Leave Rural Americans Worse Off, Says Ousted Federal Official","Starlink is cheap to deploy, but could leave rural Americans ""stranded"" with slower speeds and higher costs.",https://gizmodo.com/inferior-starlink-will-leave-rural-americans-worse-off-says-ousted-federal-official-2000576818,Gizmodo.com,The head of the Commerce Department’s ambitious plan to expand fiber internet access across rural America warned on Sunday that opening the door to SpaceX’s Starlink would leave rural Americans worse… [+4312 chars],2025-03-17,https://gizmodo.com/app/uploads/2024/05/8ca125da42e059f4ebb79e41090d2cce.jpg,inferior starlink will leave rural americans worse off says ousted federal official starlink is cheap to deploy but could leave rural americans stranded with slower speeds and higher costs,inferior starlink leave rural americans worse says ousted federal official starlink cheap deploy could leave rural americans stranded slower speeds higher costs,inferior starlink leave rural americans worse says ousted federal official starlink cheap deploy could leave rural americans stranded slower speeds higher costs
37,Lucas Ropek,Democrats Expected to Pass a Bill (Drafted by Elon’s Lawyers) That Threatens Your Retirement Fund,"It's not enough to ruin the federal government. Musk doesn't think corporations should have to play by state rules, either.",https://gizmodo.com/democrats-expected-to-pass-a-bill-drafted-by-elons-lawyers-that-threatens-your-retirement-fund-2000573901,Gizmodo.com,"Due to its highly lenient business laws, the state of Delaware has long been home to a majority of American corporations. However, that leniency is apparently not enough for the world’s richest man, … [+5046 chars]",2025-03-10,https://gizmodo.com/app/uploads/2025/03/Elon-Musk-on-Capitol-Hill.jpg,democrats expected to pass a bill drafted by elon s lawyers that threatens your retirement fund it is not enough to ruin the federal government musk does not think corporations should have to play by state rules either,democrats expected pass bill drafted elon lawyers threatens retirement fund enough ruin federal government musk think corporations play state rules either,democrats expected pass bill drafted elon lawyers threatens retirement fund enough ruin federal government musk think corporations play state rules either
