,author,title,desciption,url,source,content,pub_date,photo_url,text_combined,tokens,lemms
38,Lucas Ropek,Senate Votes to Strip CFPB of Ability to Regulate Platforms Like X,"Conservative activist and friend of Donald Trump, Laura Loomer, is freaking out.",https://gizmodo.com/senate-votes-to-strip-cfpb-of-ability-to-regulate-platforms-like-x-2000572567,Gizmodo.com,"A key federal watchdog is being stripped of its power to oversee potential fraud and abuse in online payment platforms just as Elon Musk’s site, X, attempts to become one.
Late last year, the Consum… [+4301 chars]",2025-03-06,https://gizmodo.com/app/uploads/2024/12/elon-musk-dec-5-2024-capitol-hill.jpg,senate votes to strip cfpb of ability to regulate platforms like x conservative activist and friend of donald trump laura loomer is freaking out,senate votes strip cfpb ability regulate platforms like x conservative activist friend donald trump laura loomer freaking,senate votes strip cfpb ability regulate platforms like x conservative activist friend donald trump laura loomer freaking
39,AJ Dellinger,"Trump Backtracks on Tariffs, Exempts Automakers for Another Month",This all seems extremely well thought out and planned.,https://gizmodo.com/trump-backtracks-on-tariffs-exempts-automakers-for-another-month-2000572199,Gizmodo.com,It seemed inevitable from the moment Donald Trump announced his sweeping 25% tariffs on all imports from Mexico and Canada that the carveouts would come. One day into the attempt to inflict pain on s… [+2920 chars],2025-03-05,https://gizmodo.com/app/uploads/2025/03/GettyImages-2203287073.jpg,trump backtracks on tariffs exempts automakers for another month this all seems extremely well thought out and planned,trump backtracks tariffs exempts automakers another month seems extremely well thought planned,trump backtracks tariffs exempts automakers another month seems extremely well thought planned
40,Thomas Maxwell,United Gets FAA Approval for Starlink and Sets Date for Its Debut on Flights,The satellite internet service will be free to members of its UnitedPlus loyalty program.,https://gizmodo.com/united-gets-faa-approval-for-starlink-and-sets-date-for-its-debut-on-flights-2000583060,Gizmodo.com,seUnited Airlines has been approved to begin operating flights with onboard Starlink satellite internet service. The Federal Aviation Administration issued the airline a certificate to operate the se… [+3050 chars],2025-03-31,https://gizmodo.com/app/uploads/2024/09/UnitedAirlines.jpg,united gets faa approval for starlink and sets date for its debut on flights the satellite internet service will be free to members of its unitedplus loyalty program,united gets faa approval starlink sets date debut flights satellite internet service free members unitedplus loyalty program,united gets faa approval starlink sets date debut flights satellite internet service free members unitedplus loyalty program
41,Thomas Maxwell,National Park Summer Bookings Down Amid DOGE-Fueled Turmoil,Industry insiders say uncertainty around park access is causing travelers to hold off on bookings or cancel plans entirely.,https://gizmodo.com/national-park-summer-bookings-down-amid-doge-fueled-turmoil-2000579301,Gizmodo.com,"After recent years of overcrowding, this summer might be a good time to visit your favorite national park, and you can thank Elon Musk and Big Balls for that. Tourist reservations at key hot spots ar… [+4312 chars]",2025-03-22,https://gizmodo.com/app/uploads/2023/05/de952e4f1465864a1970d92453362e0e.jpg,national park summer bookings down amid doge fueled turmoil industry insiders say uncertainty around park access is causing travelers to hold off on bookings or cancel plans entirely,national park summer bookings amid doge fueled turmoil industry insiders say uncertainty around park access causing travelers hold bookings cancel plans entirely,national park summer bookings amid doge fueled turmoil industry insiders say uncertainty around park access causing travelers hold bookings cancel plans entirely
42,Lucas Ropek,The Delaware ‘Billionaire’s Bill’ That Just Passed Is Bad News for Everyone Who Isn’t a Billionaire,This is not good news.,https://gizmodo.com/the-delaware-billionaires-bill-that-just-passed-is-bad-news-for-everyone-who-isnt-a-billionaire-2000581308,Gizmodo.com,"A piece of legislation that was written by the law firm representing Elon Musk has been passed by the state of Delaware’s Democrat-controlled legislature. Critics maintain that the bill, which now on… [+3962 chars]",2025-03-27,https://gizmodo.com/app/uploads/2025/02/Elon-Musk-at-Donald-Trumps-presidential-inauguration-.jpg,the delaware billionaire s bill that just passed is bad news for everyone who isn t a billionaire this is not good news,delaware billionaire bill passed bad news everyone billionaire good news,delaware billionaire bill passed bad news everyone billionaire good news
43,Matt Novak,Elon Musk Declares Intention to Bribe Voters (Again) to Attack U.S. Judicial System,The billionaire got away with it last time. Why not now?,https://gizmodo.com/elon-musk-declares-intention-to-bribe-voters-again-to-attack-u-s-judicial-system-2000582289,Gizmodo.com,"Wisconsin voters will go to the polls next week to choose between candidates for the state’s Supreme Court. Elon Musk has spent $17 million so far to support the Republican-aligned candidate, accordi… [+4619 chars]",2025-03-28,https://gizmodo.com/app/uploads/2024/10/elon-musk-awkward-jump.jpg,elon musk declares intention to bribe voters again to attack u s judicial system the billionaire got away with it last time why not now,elon musk declares intention bribe voters attack u judicial system billionaire got away last time,elon musk declares intention bribe voters attack u judicial system billionaire got away last time
44,Matthew Gault,20 Plagues Y Combinator Unleashed on the World Over the Last 20 Years,"On the foundational startup incubator’s 20th birthday, let’s remember some of the worst things it’s done.",https://gizmodo.com/20-plagues-y-combinator-unleashed-on-the-world-over-the-last-20-years-2000574395,Gizmodo.com,"Today marks the 20th anniversary of Y Combinator, a startup accelerator that has fostered companies that have changed the world. YC has brought us innovations like making everything an app and horrif… [+11979 chars]",2025-03-11,https://gizmodo.com/app/uploads/2025/03/YCombinator.jpg,plagues y combinator unleashed on the world over the last  years on the foundational startup incubator s th birthday let s remember some of the worst things it s done,plagues combinator unleashed world last years foundational startup incubator th birthday let remember worst things done,plagues combinator unleashed world last years foundational startup incubator th birthday let remember worst things done
50,Juli Clover,Apple Maps EV Routing for Ford Vehicles Now Supports Tesla Chargers,"Ford Mustang Mach-E and Ford F-150 Lightning customers that use the Apple Maps EV Routing feature in CarPlay can now be automatically routed to EV chargers that use the North American Charging Standard (NACS), Ford announced today.





NACS chargers include …",https://www.macrumors.com/2025/03/10/ford-apple-maps-ev-routing-nacs/,MacRumors,Ford Mustang Mach-E and Ford F-150 Lightning customers that use the Apple Maps EV Routing feature in CarPlay can now be automatically routed to EV chargers that use the North American Charging Standa… [+1364 chars],2025-03-10,https://images.macrumors.com/t/kxFzpHSfCZum7oW8OdWnMK4z6I0=/2000x/article-new/2025/03/ford-nacs-ev-routing.jpg,apple maps ev routing for ford vehicles now supports tesla chargers ford mustang mach e and ford f  lightning customers that use the apple maps ev routing feature in carplay can now be automatically routed to ev chargers that use the north american charging standard nacs ford announced today nacs chargers include,apple maps ev routing ford vehicles supports tesla chargers ford mustang mach e ford f lightning customers use apple maps ev routing feature carplay automatically routed ev chargers use north american charging standard nacs ford announced today nacs chargers include,apple maps ev routing ford vehicles supports tesla chargers ford mustang mach e ford f lightning customers use apple maps ev routing feature carplay automatically routed ev chargers use north american charging standard nacs ford announced today nacs chargers include
51,Antuan Goodwin,Ford Tested Its Gen 2 NACS Adapter by Running It Over With an F-150,"Ford EV owners can now find Tesla Superchargers via Apple Maps, and they can charge more easily and reliably.",https://www.cnet.com/home/electric-vehicles/ford-tested-its-gen-2-nacs-adapter-by-running-it-over-with-an-f-150/,CNET,"It's been a year since Ford's EVs unlocked third-party access to Tesla's Supercharger network using complimentary NACS Fast Charging Adapters. This week, the automaker doubled down on its commitment … [+3011 chars]",2025-03-11,https://www.cnet.com/a/img/resize/47b801eff0cc1866181e267e6092ba70099bf2bb/hub/2025/03/11/702155f4-deb1-4e0a-a3cc-4f0ed636c0cc/ford-charging-adapter-testing-02.jpg?auto=webp&fit=crop&height=675&width=1200,ford tested its gen  nacs adapter by running it over with an f  ford ev owners can now find tesla superchargers via apple maps and they can charge more easily and reliably,ford tested gen nacs adapter running f ford ev owners find tesla superchargers via apple maps charge easily reliably,ford tested gen nacs adapter running f ford ev owners find tesla superchargers via apple maps charge easily reliably
52,Omar Gallaga,China's BYD Claims 5-Minute EV Battery Charge Gives 250 Miles of Range,An apparent battery breakthrough could be good news for the EV industry from a Chinese company that previously pledged to work with Tesla.,https://www.cnet.com/home/electric-vehicles/chinas-byd-claims-5-minute-ev-battery-charging-gives-250-miles-of-range/,CNET,"Chinese auto manufacturer BYD says it has developed technology that speeds up electric vehicle battery charging to as little as five minutes at 1,000 kilowatts, providing enough energy for nearly 250… [+684 chars]",2025-03-18,https://www.cnet.com/a/img/resize/f183835b97e257af64efb187474d782c5614fac4/hub/2025/03/18/448efd44-d3c0-426b-aad7-314fca5b446f/gettyimages-2153819146.jpg?auto=webp&fit=crop&height=675&width=1200,china is byd claims  minute ev battery charge gives  miles of range an apparent battery breakthrough could be good news for the ev industry from a chinese company that previously pledged to work with tesla,china byd claims minute ev battery charge gives miles range apparent battery breakthrough could good news ev industry chinese company previously pledged work tesla,china byd claims minute ev battery charge gives miles range apparent battery breakthrough could good news ev industry chinese company previously pledged work tesla
53,Jesse Orrall,"These Humanoid Robots Work Together, Running the Same AI","Figure, maker of the humanoid robot Figure 02, unveiled its new Helix AI in a video showing two robots working together to put away groceries.",https://www.cnet.com/tech/computing/humanoid-robots-working-together-running-the-same-ai/,CNET,Robot-maker Figure just unveiled new videos of its Figure 02 humanoid robots working together to put away groceries and sort packages on an assembly line. The two videos showcase skills made possible… [+2640 chars],2025-03-02,https://www.cnet.com/a/img/resize/98c3340d6a35944ad301797b41eba5bb8a0e560c/hub/2025/02/28/175fb8aa-e251-4a55-9c8f-07093168e8ff/figure-thumb-5.jpg?auto=webp&fit=crop&height=675&width=1200,these humanoid robots work together running the same ai figure maker of the humanoid robot figure  unveiled its new helix ai in a video showing two robots working together to put away groceries,humanoid robots work together running ai figure maker humanoid robot figure unveiled new helix ai video showing two robots working together put away groceries,humanoid robots work together running ai figure maker humanoid robot figure unveiled new helix ai video showing two robots working together put away groceries
54,Geoffrey Morrison,"Rivian Built an Oasis in the Desert, but Can You Adventure in an EV?",An outpost with fast charging and lots of cacti. A long day covering many miles. Welcome to the electric desert.,https://www.cnet.com/roadshow/news/rivian-built-an-oasis-in-the-desert-but-can-you-adventure-in-an-ev/,CNET,"Winter in the desert is a peculiar thing. Absent is the overwhelming force that sculpted everything you see: Bleached signs, cracked paneling, squat buildings that seem beaten down by a scorching vio… [+13333 chars]",2025-03-14,https://www.cnet.com/a/img/resize/d3f57065cf9445d30ff8faa3cffd0dd23fcde994/hub/2025/03/12/b6333154-6ef0-46db-92a2-6ca8280657b4/rivian-in-the-desert-7-of-18.jpg?auto=webp&fit=crop&height=675&width=1200,rivian built an oasis in the desert but can you adventure in an ev an outpost with fast charging and lots of cacti a long day covering many miles welcome to the electric desert,rivian built oasis desert adventure ev outpost fast charging lots cacti long day covering many miles welcome electric desert,rivian built oasis desert adventure ev outpost fast charging lots cacti long day covering many miles welcome electric desert
55,jsor@businessinsider.com (Jennifer Sor),One of Tesla's biggest bulls is undeterred and calling for the stock to rally 800% over 5 years,"Cathie Wood, a longtime Tesla bull, is bullish on a low cost Tesla model, as well as the company's coming robotaxi project due to launch this year.",https://www.businessinsider.com/tesla-stock-price-prediction-tsla-cathie-wood-elon-musk-robotaxi-2025-3,Business Insider,"Cathie Wood, one of Tesla's biggest cheerleaders on Wall Street, said she's sticking to her call that the carmaker will see its stock soar more than 800% by the end of the decade.
Speaking to Bloomb… [+2891 chars]",2025-03-25,https://i.insider.com/67e2a3e1b8b41a9673fb9aca?width=1200&format=jpeg,one of tesla is biggest bulls is undeterred and calling for the stock to rally  over  years cathie wood a longtime tesla bull is bullish on a low cost tesla model as well as the company is coming robotaxi project due to launch this year,one tesla biggest bulls undeterred calling stock rally years cathie wood longtime tesla bull bullish low cost tesla model well company coming robotaxi project due launch year,one tesla biggest bulls undeterred calling stock rally years cathie wood longtime tesla bull bullish low cost tesla model well company coming robotaxi project due launch year
56,aaltchek@insider.com (Ana Altchek),It's crunch time for Tesla,"Tesla's lower-cost vehicle is supposed to begin production by June at the latest. Analysts tell BI the launch is ""crucial"" and a ""necessity.""",https://www.businessinsider.com/tesla-low-cost-cheaper-car-production-deadline-2025-3,Business Insider,"Time is ticking for Tesla's promised lower-cost vehicle.
The electric car giant said in its most recent earnings call earlier this year that production for the long-awaited ""more affordable"" Tesla w… [+3181 chars]",2025-03-11,https://i.insider.com/67cf5fc7b8b41a9673fa3983?width=1200&format=jpeg,it is crunch time for tesla tesla is lower cost vehicle is supposed to begin production by june at the latest analysts tell bi the launch is crucial and a necessity,crunch time tesla tesla lower cost vehicle supposed begin production june latest analysts tell bi launch crucial necessity,crunch time tesla tesla lower cost vehicle supposed begin production june latest analysts tell bi launch crucial necessity
57,gkay@businessinsider.com (Grace Kay),Inside xAI's organizational chart: Who's in charge at Elon Musk's company,"The ranks include Elon Musk's home office manager, his son, and former Tesla and Google engineers.",https://www.businessinsider.com/xai-org-chart-employees-elon-musk-direct-reports-2025-3,Business Insider,"At xAI, Elon Musk has marshaled a workforce that has ballooned by more than 1,000 employees in less than two years as he goes head-to-head with rivals OpenAI and Google.
Business Insider reviewed th… [+5851 chars]",2025-03-12,https://i.insider.com/67c0e258b1834fe31165bc89?width=1200&format=jpeg,inside xai is organizational chart who is in charge at elon musk is company the ranks include elon musk is home office manager his son and former tesla and google engineers,inside xai organizational chart charge elon musk company ranks include elon musk home office manager son former tesla google engineers,inside xai organizational chart charge elon musk company ranks include elon musk home office manager son former tesla google engineers
58,aaltchek@insider.com (Ana Altchek),6 falling Tesla sales numbers that should worry Elon Musk,Elon Musk told investors to expect Tesla sales to grow this year. Plummeting sales in multiple countries complicates that goal.,https://www.businessinsider.com/tesla-falling-sales-numbers-should-worry-elon-musk-2025-3,Business Insider,"Elon Musk told investors to expect Tesla sales to grow this year but plummeting sales in multiple countries around the world are complicating that goal.
While Tesla's Model Y continues to be a top s… [+2634 chars]",2025-03-05,https://i.insider.com/67c8610269253ccddf985103?width=1200&format=jpeg,falling tesla sales numbers that should worry elon musk elon musk told investors to expect tesla sales to grow this year plummeting sales in multiple countries complicates that goal,falling tesla sales numbers worry elon musk elon musk told investors expect tesla sales grow year plummeting sales multiple countries complicates goal,falling tesla sales numbers worry elon musk elon musk told investors expect tesla sales grow year plummeting sales multiple countries complicates goal
59,sjackson@insider.com (Sarah Jackson),Sen. Mark Kelly is looking into selling his Tesla over Elon Musk. Other big names have already pulled the trigger.,"""It's kind of cheaply built on the inside, but I love the performance,"" the Arizona Senator told reporters this week about his Tesla.",https://www.businessinsider.com/celebrities-politicians-who-sold-tesla-over-elon-musk-trump,Business Insider,"Sen. Mark Kelly might become the latest big name to get rid of his Tesla over Elon Musk's politics.
The Arizona Democrat told reporters on Tuesday that he's ""looking into"" selling his Tesla, though … [+424 chars]",2025-03-12,https://i.insider.com/67d1c696b8b41a9673fa6cb8?width=1200&format=jpeg,sen mark kelly is looking into selling his tesla over elon musk other big names have already pulled the trigger it is kind of cheaply built on the inside but i love the performance the arizona senator told reporters this week about his tesla,sen mark kelly looking selling tesla elon musk big names already pulled trigger kind cheaply built inside love performance arizona senator told reporters week tesla,sen mark kelly looking selling tesla elon musk big names already pulled trigger kind cheaply built inside love performance arizona senator told reporters week tesla
60,aaltchek@insider.com (Ana Altchek),Ron Baron's firm sold some Tesla shares — but he plans to keep his,"Investor Ron Baron said his firm trimmed its Tesla stake because he has to ""deal with the critiques of my clientele for how large the positions are.""",https://www.businessinsider.com/baron-capital-sells-some-tesla-stock-shares-2025-3,Business Insider,"Ron Baron said his asset management firm Baron Capital sold Tesla shares last month after concerns that its position was becoming too large.
""Everyone, you know, has to deal with certain clientele,""… [+2643 chars]",2025-03-11,https://i.insider.com/67d048f8585f1dff88b1c18f?width=1200&format=jpeg,ron baron is firm sold some tesla shares but he plans to keep his investor ron baron said his firm trimmed its tesla stake because he has to deal with the critiques of my clientele for how large the positions are,ron baron firm sold tesla shares plans keep investor ron baron said firm trimmed tesla stake deal critiques clientele large positions,ron baron firm sold tesla shares plans keep investor ron baron said firm trimmed tesla stake deal critiques clientele large positions
61,jzinkula@insider.com (Jacob Zinkula),Uber and Lyft drivers with Teslas don't want to talk about Elon Musk,Uber and Lyft drivers with Teslas reveal how they handle passenger questions about Elon Musk to preserve tips in a competitive gig economy.,https://www.businessinsider.com/tesla-elon-musk-uber-lyft-drivers-avoid-talking-politics-passengers-2025-3,Business Insider,"Some Uber and Lyft drivers with Teslas don't want to talk with riders about Elon Musk but they'll play along because it's good for business.
Wesley Johnson said his passengers regularly mention Musk… [+3809 chars]",2025-03-07,https://i.insider.com/67c8c7c669253ccddf98689a?width=1200&format=jpeg,uber and lyft drivers with teslas do not want to talk about elon musk uber and lyft drivers with teslas reveal how they handle passenger questions about elon musk to preserve tips in a competitive gig economy,uber lyft drivers teslas want talk elon musk uber lyft drivers teslas reveal handle passenger questions elon musk preserve tips competitive gig economy,uber lyft drivers teslas want talk elon musk uber lyft drivers teslas reveal handle passenger questions elon musk preserve tips competitive gig economy
62,mfox@businessinsider.com (Matthew Fox),Here are the market's biggest losers from Trump's fresh auto tariffs,"JPMorgan analyst Ryan Brinkman called the tariffs ""draconian"" and lowered the bank's price targets for General Motors, Ford, and Ferrari as a result.",https://www.businessinsider.com/auto-tariffs-stocks-biggest-losers-trump-trade-war-ford-gm-2025-3,Business Insider,"President Donald Trump announced a 25% tariff rate on all imported vehicles on Wednesday, and investors are spooked. 
Most auto stocks moved lower on Thursday in reaction to the tariffs, with variou… [+2212 chars]",2025-03-27,https://i.insider.com/67e55770b8b41a9673fbd85c?width=1200&format=jpeg,here are the market is biggest losers from trump is fresh auto tariffs jpmorgan analyst ryan brinkman called the tariffs draconian and lowered the bank is price targets for general motors ford and ferrari as a result,market biggest losers trump fresh auto tariffs jpmorgan analyst ryan brinkman called tariffs draconian lowered bank price targets general motors ford ferrari result,market biggest losers trump fresh auto tariffs jpmorgan analyst ryan brinkman called tariffs draconian lowered bank price targets general motors ford ferrari result
63,jzinkula@insider.com (Jacob Zinkula),"A part-time Uber driver who earned $24,000 last year explains how he thinks a ukulele and an EV earned him more tips",Uber and Lyft drivers say inconsistent tipping makes a difficult earnings environment even harder. One driver shares his tricks.,https://www.businessinsider.com/how-get-more-tips-driving-uber-lyft-passenger-conversations-2025-3,Business Insider,"Gabe Ets-Hokin was struggling to get his rideshare customers to leave tips. Then he bought a ukulele.
""It sparks lots of questions, conversations, and connections,"" the 56-year-old told Business Ins… [+4007 chars]",2025-03-08,https://i.insider.com/67cb38b369253ccddf989fa3?width=1200&format=jpeg,a part time uber driver who earned   last year explains how he thinks a ukulele and an ev earned him more tips uber and lyft drivers say inconsistent tipping makes a difficult earnings environment even harder one driver shares his tricks,part time uber driver earned last year explains thinks ukulele ev earned tips uber lyft drivers say inconsistent tipping makes difficult earnings environment even harder one driver shares tricks,part time uber driver earned last year explains thinks ukulele ev earned tips uber lyft drivers say inconsistent tipping makes difficult earnings environment even harder one driver shares tricks
64,ewebb@insider.com (Effie Webb),A judge blocked Musk's bid to stop OpenAI's for-profit conversion — but he'll still get his day in court,"A judge denied Elon Musk's bid to stop Sam Altman from converting OpenAI into a for-profit, but the rivals are still set to have their day in court.",https://www.businessinsider.com/elon-musk-openai-lawsuit-for-profit-block-trial-sam-altman-2025-3,Business Insider,"A judge has denied Elon Musk's bid to stop Sam Altman from converting OpenAI into a for-profit entity but said other areas of the lawsuit could be expedited to trial.
In a Tuesday filing, US Distric… [+2336 chars]",2025-03-05,https://i.insider.com/67c833ccb8b41a9673f9b504?width=1000&format=jpeg,a judge blocked musk is bid to stop openai is for profit conversion but he will still get his day in court a judge denied elon musk is bid to stop sam altman from converting openai into a for profit but the rivals are still set to have their day in court,judge blocked musk bid stop openai profit conversion still get day court judge denied elon musk bid stop sam altman converting openai profit rivals still set day court,judge blocked musk bid stop openai profit conversion still get day court judge denied elon musk bid stop sam altman converting openai profit rivals still set day court
