,author,title,desciption,url,source,content,pub_date,photo_url,text_combined,tokens,lemms
0,Jeremy White,"Donald Trump Bought a $90,000 Tesla With 37 Recall Notices Against It",Here's hoping Elon Musk won't have to personally fix President Trump's new EV anytime soon.,https://www.wired.com/story/donald-trump-bought-a-dollar90000-tesla-with-37-recall-notices-against-it/,Wired,"Likely referring to the significant negative coverage of Musk's efforts leading the so-called Department of Government Efficiency (DOGE), the president committed to buying a Tesla via TruthSocial on … [+2607 chars]",2025-03-12,"https://media.wired.com/photos/67d1b556d38aff896fec27be/191:100/w_1280,c_limit/trump-tesla-gear-2204588044.jpg",donald trump bought a   tesla with  recall notices against it here is hoping elon musk wo not have to personally fix president trump is new ev anytime soon,donald trump bought tesla recall notices hoping elon musk wo personally fix president trump new ev anytime soon,donald trump bought tesla recall notices hoping elon musk wo personally fix president trump new ev anytime soon
1,Brian Barrett,The United States of Elon Musk Inc.,The degree to which Donald Trump and Elon Musk’s interests are intertwined is unprecedented—and ultimately unsustainable.,https://www.wired.com/story/elon-musk-donald-trump-doge-congress-takeover/,Wired,"Where do Elon Musks business interests end and Donald Trumps political interests begin? Trick questiontheyre one and the same.
How else do you explain the jarring sight of the President of the Unite… [+2965 chars]",2025-03-13,"https://media.wired.com/photos/67d21b81e3dd1d52d70b101e/191:100/w_1280,c_limit/politics_newsletter_united_states_musk_inc.jpg",the united states of elon musk inc the degree to which donald trump and elon musk s interests are intertwined is unprecedented and ultimately unsustainable,united states elon musk inc degree donald trump elon musk interests intertwined unprecedented ultimately unsustainable,united states elon musk inc degree donald trump elon musk interests intertwined unprecedented ultimately unsustainable
2,Martin Cizmar,Comfort Colors T-Shirts Are the Only Thing I’ll Wear,I happened upon the budget brand at a chintzy souvenir shop in Maine. I've since sworn full allegiance to the cult of Comfort Colors.,https://www.wired.com/story/comfort-colors-t-shirts-are-the-best/,Wired,"I tend to buy T-shirts in bunches. Anytime I find a shirt I really like, I acquire at least a week's worth. In the era retroactively known as indie sleaze, I was outfitted exclusively in American App… [+2366 chars]",2025-03-08,"https://media.wired.com/photos/67ca2747f792a8fe36e66a96/191:100/w_1280,c_limit/Comfort-Colors-T-Shirts-Reviewer-Collage-032025-SOURCE-Martin-Cizmar.jpg",comfort colors t shirts are the only thing i ll wear i happened upon the budget brand at a chintzy souvenir shop in maine i have since sworn full allegiance to the cult of comfort colors,comfort colors shirts thing wear happened upon budget brand chintzy souvenir shop maine since sworn full allegiance cult comfort colors,comfort colors shirts thing wear happened upon budget brand chintzy souvenir shop maine since sworn full allegiance cult comfort colors
3,Aarian Marshall,Tesla Got a Permit to Operate a Taxi Service in California—but There's a Catch,"The taxi service will initially operate with Tesla employee drivers only, use current-model vehicles, and won't allow for driverless rides.",https://www.wired.com/story/tesla-got-a-permit-to-operate-a-taxi-service-in-california-but-theres-a-catch/,Wired,"Tesla has been granted a permit to operate a taxi service in California, a spokesperson for the California Public Utilities Commission, a state regulator, said Tuesday. It marks the first step toward… [+3418 chars]",2025-03-18,"https://media.wired.com/photos/67d9e302de323b7691481579/191:100/w_1280,c_limit/Gear_Cybercab_GettyImages-2193378832.jpg",tesla got a permit to operate a taxi service in california but there is a catch the taxi service will initially operate with tesla employee drivers only use current model vehicles and wo not allow for driverless rides,tesla got permit operate taxi service california catch taxi service initially operate tesla employee drivers use current model vehicles wo allow driverless rides,tesla got permit operate taxi service california catch taxi service initially operate tesla employee drivers use current model vehicles wo allow driverless rides
4,Aarian Marshall,Ford Is Sticking With an EV Future,CEO Jim Farley tells us that every qualified owner of a Ford electric car has received an adaptor that allows them to charge up at Tesla-operated Supercharger stations.,https://www.wired.com/story/ford-ev-charging-adapters-for-tesla-superchargers/,Wired,"The road to progress has never been smooth. Witness, as a metaphor, the trials and tribulations of the Ford Motor Company as it has tried to sell electric vehicle drivers the premier charging experie… [+3080 chars]",2025-03-11,"https://media.wired.com/photos/67cef3290b79bb0f653a06c3/191:100/w_1280,c_limit/Ford%20Charging%20Adapter_Mustang%20Mach-E_2_.jpg",ford is sticking with an ev future ceo jim farley tells us that every qualified owner of a ford electric car has received an adaptor that allows them to charge up at tesla operated supercharger stations,ford sticking ev future ceo jim farley tells us every qualified owner ford electric car received adaptor allows charge tesla operated supercharger stations,ford sticking ev future ceo jim farley tells us every qualified owner ford electric car received adaptor allows charge tesla operated supercharger stations
5,Makena Kelly,DOGE Is Putting Major Government Efficiency Projects at Risk,"In its apparent quest to cut government spending and improve efficiency, DOGE has fired entire tech teams devoted to those very things.",https://www.wired.com/story/doge-major-government-tech-projects-efficiency/,Wired,"18F was the peoples tech shop, one fired 18F worker tells WIRED. Theres a giant hole left by the closure of 18F. Requests from across the country for help far outpaced 18Fs capacity before the closur… [+3048 chars]",2025-03-07,"https://media.wired.com/photos/67ca184bfec307c84aad3ce6/191:100/w_1280,c_limit/pol_doge_tech_GettyImages-2201505740.jpg",doge is putting major government efficiency projects at risk in its apparent quest to cut government spending and improve efficiency doge has fired entire tech teams devoted to those very things,doge putting major government efficiency projects risk apparent quest cut government spending improve efficiency doge fired entire tech teams devoted things,doge putting major government efficiency projects risk apparent quest cut government spending improve efficiency doge fired entire tech teams devoted things
6,Will Knight,"Under Trump, AI Scientists Are Told to Remove ‘Ideological Bias’ From Powerful Models",A directive from the National Institute of Standards and Technology eliminates mention of “AI safety” and “AI fairness.”,https://www.wired.com/story/ai-safety-institute-new-directive-america-first/,Wired,The National Institute of Standards and Technology (NIST) has issued new instructions to scientists that partner with the US Artificial Intelligence Safety Institute (AISI) that eliminate mention of … [+3395 chars],2025-03-14,"https://media.wired.com/photos/67c77508ad19f713de02a563/191:100/w_1280,c_limit/trump-pointing-2202608030.jpg",under trump ai scientists are told to remove ideological bias from powerful models a directive from the national institute of standards and technology eliminates mention of ai safety and ai fairness,trump ai scientists told remove ideological bias powerful models directive national institute standards technology eliminates mention ai safety ai fairness,trump ai scientists told remove ideological bias powerful models directive national institute standards technology eliminates mention ai safety ai fairness
7,Andrew J. Hawkins,Is Tesla cooked?,"Tesla stock plunged 15 percent on Monday, its steepest drop in five years. The price is down over 50 percent since its December highs. Tesla owners, disgusted with Elon Muskâs slash-and-burn tactics for the Trump administration, are selling their vehicles a…",https://www.theverge.com/tesla/627894/tesla-stock-sales-protest-musk-trump-doge,The Verge,"The CEO is absent, the stocks are plummeting, and the brand is toxic. Teslas future looks grim. 
The CEO is absent, the stocks are plummeting, and the brand is toxic. Teslas future looks grim. 
Tes… [+10200 chars]",2025-03-11,https://platform.theverge.com/wp-content/uploads/sites/2/2025/03/STK022_ELON_MUSK_4_CVIRGINIA_B.webp?quality=90&strip=all&crop=0%2C10.732984293194%2C100%2C78.534031413613&w=1200,is tesla cooked tesla stock plunged  percent on monday its steepest drop in five years the price is down over  percent since its december highs tesla owners disgusted with elon musk s slash and burn tactics for the trump administration are selling their vehicles a,tesla cooked tesla stock plunged percent monday steepest drop five years price percent since december highs tesla owners disgusted elon musk slash burn tactics trump administration selling vehicles,tesla cooked tesla stock plunged percent monday steepest drop five years price percent since december highs tesla owners disgusted elon musk slash burn tactics trump administration selling vehicles
8,Andrew J. Hawkins,Tesla Takedown: all the news about the protests roiling the automaker,"Since early February, Tesla has been the target of protesters opposed to CEO Elon Musk’s unprecedented takeover of the federal government. As Musk’s Department of Government Efficiency (DOGE) eliminates humanitarian aid programs and fires tens of thousands of…",https://www.theverge.com/news/635249/tesla-takedown-protest-stock-elon-musk-future,The Verge,"Since early February, Tesla has been the target of protesters opposed to CEO Elon Musks unprecedented takeover of the federal government. As Musks Department of Government Efficiency (DOGE) eliminate… [+6935 chars]",2025-03-25,https://platform.theverge.com/wp-content/uploads/sites/2/2025/02/STK086_TeslaB.jpg?quality=90&strip=all&crop=0%2C10.732984293194%2C100%2C78.534031413613&w=1200,tesla takedown all the news about the protests roiling the automaker since early february tesla has been the target of protesters opposed to ceo elon musk s unprecedented takeover of the federal government as musk s department of government efficiency doge eliminates humanitarian aid programs and fires tens of thousands of,tesla takedown news protests roiling automaker since early february tesla target protesters opposed ceo elon musk unprecedented takeover federal government musk department government efficiency doge eliminates humanitarian aid programs fires tens thousands,tesla takedown news protests roiling automaker since early february tesla target protesters opposed ceo elon musk unprecedented takeover federal government musk department government efficiency doge eliminates humanitarian aid programs fires tens thousands
9,Nilay Patel,How the Tesla brand turned so toxic,"Today we’re talking about the protests against Tesla, which have been branded on social media under the hashtag Tesla Takedown. The protests are, of course, a reaction to Elon Musk, who has managed to install himself as basically a not-so-shadow president who…",https://www.theverge.com/decoder-podcast-with-nilay-patel/633200/tesla-takedown-protest-elon-musk-toxic,The Verge,"How the Tesla brand turned so toxic
The Tesla Takedown movement is rallying against Elon Musk, and its only getting bigger.
How the Tesla brand turned so toxic
The Tesla Takedown movement is rally… [+3899 chars]",2025-03-20,https://platform.theverge.com/wp-content/uploads/sites/2/2025/03/DCD_0320.jpg?quality=90&strip=all&crop=0%2C10.732984293194%2C100%2C78.534031413613&w=1200,how the tesla brand turned so toxic today we re talking about the protests against tesla which have been branded on social media under the hashtag tesla takedown the protests are of course a reaction to elon musk who has managed to install himself as basically a not so shadow president who,tesla brand turned toxic today talking protests tesla branded social media hashtag tesla takedown protests course reaction elon musk managed install basically shadow president,tesla brand turned toxic today talking protests tesla branded social media hashtag tesla takedown protests course reaction elon musk managed install basically shadow president
10,Richard Lawler,The FBI launched a task force to investigate Tesla attacks,A report in the New York Post on Monday revealed the existence of a new 10-person FBI task force focused on vandalism and other activity aimed toward Tesla in response to the actions of Elon Musk.  Like Attorney General Pam Bondi’s re-announcement last week o…,https://www.theverge.com/news/635091/fbi-tesla-task-force-terrorism,The Verge,"The FBI is reportedly looking into incidents of vandalism and arson, and tracking the planned Tesla Takedown protests.
The FBI is reportedly looking into incidents of vandalism and arson, and tracki… [+1818 chars]",2025-03-24,https://platform.theverge.com/wp-content/uploads/sites/2/2025/03/gettyimages-2205777093.jpg?quality=90&strip=all&crop=0%2C10.14263417715%2C100%2C79.714731645701&w=1200,the fbi launched a task force to investigate tesla attacks a report in the new york post on monday revealed the existence of a new  person fbi task force focused on vandalism and other activity aimed toward tesla in response to the actions of elon musk like attorney general pam bondi s re announcement last week o,fbi launched task force investigate tesla attacks report new york post monday revealed existence new person fbi task force focused vandalism activity aimed toward tesla response actions elon musk like attorney general pam bondi announcement last week,fbi launched task force investigate tesla attacks report new york post monday revealed existence new person fbi task force focused vandalism activity aimed toward tesla response actions elon musk like attorney general pam bondi announcement last week
11,Richard Lawler,US attorney general re-announces ‘severe’ charges against alleged Tesla arsonists,"As reports of vandalism and even a supposed doxing website targeting Tesla locations and vehicles continue to appear, Attorney General Pam Bondi issued a new warning about old crimes. In a Department of Justice press release, she “announced charges against th…",https://www.theverge.com/news/633445/pam-bondi-announces-old-tesla-vandalism-arrests,The Verge,"But in a scary voice this time.
But in a scary voice this time.
As reports of vandalism and even a supposed doxing website targeting Tesla locations and vehicles continue to appear, Attorney Genera… [+1366 chars]",2025-03-20,https://platform.theverge.com/wp-content/uploads/sites/2/2025/03/gettyimages-2205773666.jpg?quality=90&strip=all&crop=0%2C13.641556866819%2C83.6%2C63.333858116722&w=1200,us attorney general re announces severe charges against alleged tesla arsonists as reports of vandalism and even a supposed doxing website targeting tesla locations and vehicles continue to appear attorney general pam bondi issued a new warning about old crimes in a department of justice press release she announced charges against th,us attorney general announces severe charges alleged tesla arsonists reports vandalism even supposed doxing website targeting tesla locations vehicles continue appear attorney general pam bondi issued new warning old crimes department justice press release announced charges th,us attorney general announces severe charges alleged tesla arsonists reports vandalism even supposed doxing website targeting tesla locations vehicles continue appear attorney general pam bondi issued new warning old crimes department justice press release announced charges th
12,Andrew J. Hawkins,Ford’s Tesla Supercharger adapters are now on sale for $200,"Ford is making some changes to how it handles its EV charging accessories. The company was the first to announce its plans to adopt Tesla’s North American Charging Standard (NACS) connector for its EVs, and was also first to distribute NACS adapters to its EV…",https://www.theverge.com/news/627230/ford-nacs-adapter-tesla-supercharger-price,The Verge,"Ford has dealt with delays and supply shortages in getting NACS adapters to customers.
Ford has dealt with delays and supply shortages in getting NACS adapters to customers.
Ford is making some cha… [+2338 chars]",2025-03-10,https://platform.theverge.com/wp-content/uploads/sites/2/2025/03/Ford-Charging-Adapter_Connecting.jpg?quality=90&strip=all&crop=0%2C10.732984293194%2C100%2C78.534031413613&w=1200,ford s tesla supercharger adapters are now on sale for  ford is making some changes to how it handles its ev charging accessories the company was the first to announce its plans to adopt tesla s north american charging standard nacs connector for its evs and was also first to distribute nacs adapters to its ev,ford tesla supercharger adapters sale ford making changes handles ev charging accessories company first announce plans adopt tesla north american charging standard nacs connector evs also first distribute nacs adapters ev,ford tesla supercharger adapters sale ford making changes handles ev charging accessories company first announce plans adopt tesla north american charging standard nacs connector evs also first distribute nacs adapters ev
13,Andrew J. Hawkins,Tesla Cybertruck deliveries reportedly on hold because the trim is flying off,America’s favorite low poly electric truck is facing a new set of problems that don’t have anything to do with people spray painting swastikas or crude comments about Elon Musk on them. Deliveries of the Tesla Cybertruck are on hold while the company addresse…,https://www.theverge.com/news/629352/tesla-cybertruck-deliveries-on-hold-loose-trim,The Verge,America’s favorite low poly electric truck is facing a new set of problems that don’t have anything to do with people spray painting swastikas or crude comments about Elon Musk on them. Deliveries of… [+1951 chars],2025-03-13,https://platform.theverge.com/wp-content/uploads/sites/2/chorus/uploads/chorus_asset/file/25830320/STKS493_CYBERTRUCK_CVIRGINIA_B.jpg?quality=90&strip=all&crop=0%2C10.732984293194%2C100%2C78.534031413613&w=1200,tesla cybertruck deliveries reportedly on hold because the trim is flying off america s favorite low poly electric truck is facing a new set of problems that don t have anything to do with people spray painting swastikas or crude comments about elon musk on them deliveries of the tesla cybertruck are on hold while the company addresse,tesla cybertruck deliveries reportedly hold trim flying america favorite low poly electric truck facing new set problems anything people spray painting swastikas crude comments elon musk deliveries tesla cybertruck hold company addresse,tesla cybertruck deliveries reportedly hold trim flying america favorite low poly electric truck facing new set problems anything people spray painting swastikas crude comments elon musk deliveries tesla cybertruck hold company addresse
14,Umar Shakir,Elon Musk made more promises about Optimus and Cybercabs at Tesla’s surprise all-hands meeting,"At a surprise all-hands-on meeting Thursday night in Texas, Tesla CEO Elon Musk rallied up his company’s employees as the brand’s public reputation continues to plummet, Business Insider reports. At the livestreamed meeting, Musk told employees to “hang on to…",https://www.theverge.com/news/633907/elon-musk-tesla-employee-meeting-stock-value-drop-cybercab-optimus,The Verge,"The Tesla CEO pleads with employees (and, indirectly, to investors) to hang onto their stocks.
The Tesla CEO pleads with employees (and, indirectly, to investors) to hang onto their stocks.
At a su… [+2089 chars]",2025-03-21,https://platform.theverge.com/wp-content/uploads/sites/2/2025/01/STK022_ELON_MUSK_2_CVIRGINIA_B.jpg?quality=90&strip=all&crop=0%2C9.9676601489831%2C100%2C80.064679702034&w=1200,elon musk made more promises about optimus and cybercabs at tesla s surprise all hands meeting at a surprise all hands on meeting thursday night in texas tesla ceo elon musk rallied up his company s employees as the brand s public reputation continues to plummet business insider reports at the livestreamed meeting musk told employees to hang on to,elon musk made promises optimus cybercabs tesla surprise hands meeting surprise hands meeting thursday night texas tesla ceo elon musk rallied company employees brand public reputation continues plummet business insider reports livestreamed meeting musk told employees hang,elon musk made promises optimus cybercabs tesla surprise hands meeting surprise hands meeting thursday night texas tesla ceo elon musk rallied company employees brand public reputation continues plummet business insider reports livestreamed meeting musk told employees hang
15,Andrew J. Hawkins,The Nissan Leaf lives on as a compact SUV with a Tesla charge port,"The Nissan Leaf is back, and it’s not a frumpy looking hatchback anymore.  The Japanese automaker is dusting off its pioneering EV and giving it new technology and a new form factor. The Leaf will return as a crossover SUV with a Tesla plug (!!), casting off …",https://www.theverge.com/news/636386/nissan-leaf-third-generation-ev-suv-nacs,The Verge,"The rumors of my demise were greatly exaggerated.
The rumors of my demise were greatly exaggerated.
The Nissan Leaf is back, and its not a frumpy looking hatchback anymore. 
The Japanese automaker… [+3269 chars]",2025-03-26,https://platform.theverge.com/wp-content/uploads/sites/2/2025/03/All-new-Nissan-LEAF.jpg?quality=90&strip=all&crop=0%2C2.9824320816538%2C100%2C94.035135836692&w=1200,the nissan leaf lives on as a compact suv with a tesla charge port the nissan leaf is back and it s not a frumpy looking hatchback anymore the japanese automaker is dusting off its pioneering ev and giving it new technology and a new form factor the leaf will return as a crossover suv with a tesla plug casting off,nissan leaf lives compact suv tesla charge port nissan leaf back frumpy looking hatchback anymore japanese automaker dusting pioneering ev giving new technology new form factor leaf return crossover suv tesla plug casting,nissan leaf lives compact suv tesla charge port nissan leaf back frumpy looking hatchback anymore japanese automaker dusting pioneering ev giving new technology new form factor leaf return crossover suv tesla plug casting
16,David Pierce,The fake promise of better Siri,"Apple Intelligence is technically lots of things, but thereâs only one feature with the potential to actually meaningfully change the way you use your phone. That would be Siri, which Apple said last year it had turned from a quasi-helpful voice assistant i…",https://www.theverge.com/the-vergecast/629652/siri-delay-bad-apple-tesla-trump-vergecast,The Verge,"On The Vergecast: AI gadget failures, how Tesla became politics, and Sonoss TV dreams.
On The Vergecast: AI gadget failures, how Tesla became politics, and Sonoss TV dreams.
Apple Intelligence is t… [+2130 chars]",2025-03-14,https://platform.theverge.com/wp-content/uploads/sites/2/2025/03/VST_0314_Site.jpg?quality=90&strip=all&crop=0%2C10.732984293194%2C100%2C78.534031413613&w=1200,the fake promise of better siri apple intelligence is technically lots of things but there s only one feature with the potential to actually meaningfully change the way you use your phone that would be siri which apple said last year it had turned from a quasi helpful voice assistant i,fake promise better siri apple intelligence technically lots things one feature potential actually meaningfully change way use phone would siri apple said last year turned quasi helpful voice assistant,fake promise better siri apple intelligence technically lots things one feature potential actually meaningfully change way use phone would siri apple said last year turned quasi helpful voice assistant
17,Andrew J. Hawkins,The Volkswagen ID. EVERY1 is an affordable EV for the masses,"Volkswagen is bringing up the lights on the ID. EVERY1 show car that it says will become the promised €20,000 (about $20,800 USD) affordable EV that will hopefully turn around the automaker’s struggling business.  As market leaders like Tesla continue to prom…",https://www.theverge.com/news/624676/vw-id-every1-ev-price-range-specs-2027,The Verge,"The sporty hatchback will sell for 20,000 when it launches in Europe in 2027. But when will we see it in the US?
The sporty hatchback will sell for 20,000 when it launches in Europe in 2027. But whe… [+4137 chars]",2025-03-05,https://platform.theverge.com/wp-content/uploads/sites/2/2025/03/ID1_34front.jpg?quality=90&strip=all&crop=0%2C10.752696650476%2C100%2C78.494606699048&w=1200,the volkswagen id every is an affordable ev for the masses volkswagen is bringing up the lights on the id every show car that it says will become the promised   about   usd affordable ev that will hopefully turn around the automaker s struggling business as market leaders like tesla continue to prom,volkswagen id every affordable ev masses volkswagen bringing lights id every show car says become promised usd affordable ev hopefully turn around automaker struggling business market leaders like tesla continue prom,volkswagen id every affordable ev masses volkswagen bringing lights id every show car says become promised usd affordable ev hopefully turn around automaker struggling business market leaders like tesla continue prom
